{
  "schema_version": "1.0.0",
  "diagnostic_contract_version": 1,
  "doctor_version": "1.0.0",
  "goallatch_version": "0.1.1",
  "platform": {
    "operating_system": "linux",
    "architecture": "x86_64",
    "host_target": "linux-x86_64",
    "support_status": "supported",
    "experimental": false,
    "unix_sandbox_parity": "available"
  },
  "installation": {
    "install_contract_version": 1,
    "helper_resolution": "current_exe_sibling",
    "current_exe": { "observed": true, "path_redacted": true, "basename_matches_expected": true, "directory_observed": true, "resolution": "as_observed" },
    "required_helpers": [
      { "name": "atomic-publish", "required": true, "present": true, "regular_file": true, "readable": true, "executable": true, "resolution": "current_exe_sibling", "status": "PASS" },
      { "name": "codex-linux-sandbox", "required": true, "present": true, "regular_file": true, "readable": true, "executable": true, "resolution": "current_exe_sibling", "status": "PASS" }
    ],
    "forbidden_helpers": [],
    "symlink_status": "UNKNOWN",
    "nix_validation_status": "UNKNOWN"
  },
  "dependencies": {
    "codex_cli": {
      "resolution_source": "none",
      "selected": false,
      "path_redacted": true,
      "file_status": "missing",
      "executable_status": "BLOCK",
      "version_probe": { "requested": false, "attempted": false, "status": "UNKNOWN", "version": null, "timeout_seconds": 2, "reason_code": "CODEX_CLI_NOT_FOUND" }
    },
    "bubblewrap": {
      "applicable": true,
      "found": true,
      "version": null,
      "minimum_version": "0.12.0",
      "version_probe": { "requested": false, "attempted": false, "status": "UNKNOWN", "version": null, "timeout_seconds": 5, "reason_code": "BWRAP_VERSION_UNPROBED" }
    },
    "macos_sandbox_exec": { "applicable": false, "present": null, "executable_status": "UNKNOWN", "runtime_status": "UNKNOWN" }
  },
  "capabilities": {
    "mcp_transport": { "requirement": "required", "status": "PASS", "formal_status": "PASS", "runtime_status": "UNKNOWN", "reason_codes": ["CAPABILITY_AVAILABLE", "RUNTIME_VERIFICATION_NOT_RUN"] },
    "session_management": { "requirement": "required", "status": "PASS", "formal_status": "PASS", "runtime_status": "UNKNOWN", "reason_codes": ["CAPABILITY_AVAILABLE", "RUNTIME_VERIFICATION_NOT_RUN"] },
    "sandboxed_execution": { "requirement": "required", "status": "UNKNOWN", "formal_status": "PASS", "runtime_status": "UNKNOWN", "reason_codes": ["BWRAP_VERSION_UNPROBED", "BWRAP_RUNTIME_PREREQUISITES_UNKNOWN"] },
    "atomic_publication": { "requirement": "required", "status": "PASS", "formal_status": "PASS", "runtime_status": "UNKNOWN", "reason_codes": ["CAPABILITY_AVAILABLE", "RUNTIME_VERIFICATION_NOT_RUN"] },
    "goal_model_execution": { "requirement": "optional", "status": "BLOCK", "formal_status": "BLOCK", "runtime_status": "UNKNOWN", "reason_codes": ["CODEX_CLI_NOT_FOUND"] }
  },
  "checks": [
    { "id": "platform.support", "status": "PASS", "requirement": "required", "applicability": "applicable", "evidence_type": "formal_contract", "observed": "supported", "reason_code": "CAPABILITY_AVAILABLE", "message": "This target is in the supported matrix.", "capability": null },
    { "id": "installation.atomic_publish_sibling", "status": "PASS", "requirement": "required", "applicability": "applicable", "evidence_type": "static_observation", "observed": { "present": true, "regular_file": true, "readable": true, "executable": true }, "reason_code": "CAPABILITY_AVAILABLE", "message": "The required publication helper is beside the observed executable.", "capability": "atomic_publication" },
    { "id": "capability.mcp_transport_contract", "status": "PASS", "requirement": "required", "applicability": "applicable", "evidence_type": "formal_contract", "observed": "declared", "reason_code": "CAPABILITY_AVAILABLE", "message": "MCP transport is included in this build contract.", "capability": "mcp_transport" },
    { "id": "capability.session_management_contract", "status": "PASS", "requirement": "required", "applicability": "applicable", "evidence_type": "formal_contract", "observed": "declared", "reason_code": "CAPABILITY_AVAILABLE", "message": "Session management is included in this build contract.", "capability": "session_management" },
    { "id": "sandbox.bubblewrap.version", "status": "UNKNOWN", "requirement": "required", "applicability": "applicable", "evidence_type": "not_run", "observed": null, "reason_code": "BWRAP_VERSION_UNPROBED", "message": "The version probe was not explicitly requested; file presence is not version evidence.", "capability": "sandboxed_execution" },
    { "id": "sandbox.runtime_prerequisites", "status": "UNKNOWN", "requirement": "required", "applicability": "applicable", "evidence_type": "not_run", "observed": null, "reason_code": "BWRAP_RUNTIME_PREREQUISITES_UNKNOWN", "message": "Namespace, seccomp, and kernel behavior were not tested.", "capability": "sandboxed_execution" },
    { "id": "goal_model.codex_cli", "status": "BLOCK", "requirement": "optional", "applicability": "applicable", "evidence_type": "static_observation", "observed": { "selected": false, "path_redacted": true }, "reason_code": "CODEX_CLI_NOT_FOUND", "message": "Codex CLI is unavailable; MCP transport remains independent.", "capability": "goal_model_execution" },
    { "id": "installation.symlink_origin", "status": "UNKNOWN", "requirement": "optional", "applicability": "applicable", "evidence_type": "not_run", "observed": null, "reason_code": "INSTALL_SYMLINK_ORIGIN_UNKNOWN", "message": "No symlink launch was attempted.", "capability": null },
    { "id": "installation.nix_validation", "status": "UNKNOWN", "requirement": "optional", "applicability": "applicable", "evidence_type": "not_run", "observed": null, "reason_code": "INSTALL_NIX_UNVERIFIED", "message": "Nix build and run behavior are not verified.", "capability": null }
  ],
  "summary": {
    "status": "UNKNOWN",
    "required_status": "UNKNOWN",
    "advisory_status": "BLOCK",
    "runtime_status": "UNKNOWN",
    "counts": { "PASS": 4, "WARN": 0, "BLOCK": 1, "UNKNOWN": 4 },
    "checks_total": 9,
    "required_blockers": 0,
    "required_unknowns": 2,
    "exit_code": 2
  }
}
