{
  "schema_version": "1.0.0",
  "diagnostic_contract_version": 1,
  "doctor_version": "1.0.0",
  "goallatch_version": "0.1.1",
  "platform": {
    "operating_system": "windows",
    "architecture": "x86_64",
    "host_target": "windows-x86_64",
    "support_status": "experimental",
    "experimental": true,
    "unix_sandbox_parity": "unavailable"
  },
  "installation": {
    "install_contract_version": 1,
    "helper_resolution": "current_exe_sibling",
    "current_exe": { "observed": true, "path_redacted": true, "basename_matches_expected": true, "directory_observed": true, "resolution": "as_observed" },
    "required_helpers": [
      { "name": "atomic-publish.exe", "required": true, "present": true, "regular_file": true, "readable": true, "executable": true, "resolution": "current_exe_sibling", "status": "PASS" }
    ],
    "forbidden_helpers": [
      { "name": "codex-linux-sandbox", "required": false, "present": false, "regular_file": false, "readable": false, "executable": false, "resolution": "not_applicable", "status": "PASS" },
      { "name": "codex-linux-sandbox.exe", "required": false, "present": false, "regular_file": false, "readable": false, "executable": false, "resolution": "not_applicable", "status": "PASS" }
    ],
    "symlink_status": "UNKNOWN",
    "nix_validation_status": "UNKNOWN"
  },
  "dependencies": {
    "codex_cli": {
      "resolution_source": "none",
      "selected": false,
      "path_redacted": true,
      "file_status": "missing",
      "executable_status": "BLOCK",
      "version_probe": { "requested": false, "attempted": false, "status": "UNKNOWN", "version": null, "timeout_seconds": 2, "reason_code": "CODEX_CLI_NOT_FOUND" }
    },
    "bubblewrap": {
      "applicable": false,
      "found": null,
      "version": null,
      "minimum_version": "0.12.0",
      "version_probe": { "requested": false, "attempted": false, "status": "UNKNOWN", "version": null, "timeout_seconds": 5, "reason_code": "CHECK_NOT_APPLICABLE" }
    },
    "macos_sandbox_exec": { "applicable": false, "present": null, "executable_status": "UNKNOWN", "runtime_status": "UNKNOWN" }
  },
  "capabilities": {
    "mcp_transport": { "requirement": "required", "status": "PASS", "formal_status": "PASS", "runtime_status": "UNKNOWN", "reason_codes": ["CAPABILITY_AVAILABLE", "RUNTIME_VERIFICATION_NOT_RUN"] },
    "session_management": { "requirement": "required", "status": "PASS", "formal_status": "PASS", "runtime_status": "UNKNOWN", "reason_codes": ["CAPABILITY_AVAILABLE", "RUNTIME_VERIFICATION_NOT_RUN"] },
    "sandboxed_execution": { "requirement": "not_applicable", "status": "UNKNOWN", "formal_status": "UNKNOWN", "runtime_status": "UNKNOWN", "reason_codes": ["SANDBOX_PARITY_NOT_APPLICABLE"] },
    "atomic_publication": { "requirement": "required", "status": "PASS", "formal_status": "PASS", "runtime_status": "UNKNOWN", "reason_codes": ["CAPABILITY_AVAILABLE", "RUNTIME_VERIFICATION_NOT_RUN"] },
    "goal_model_execution": { "requirement": "optional", "status": "BLOCK", "formal_status": "BLOCK", "runtime_status": "UNKNOWN", "reason_codes": ["CODEX_CLI_NOT_FOUND"] }
  },
  "checks": [
    { "id": "platform.windows_experimental", "status": "WARN", "requirement": "required", "applicability": "applicable", "evidence_type": "formal_contract", "observed": "experimental", "reason_code": "PLATFORM_WINDOWS_EXPERIMENTAL", "message": "Windows is Experimental and has no Unix-equivalent process sandbox.", "capability": null },
    { "id": "installation.atomic_publish_sibling", "status": "PASS", "requirement": "required", "applicability": "applicable", "evidence_type": "static_observation", "observed": { "present": true, "regular_file": true, "readable": true, "executable": true }, "reason_code": "CAPABILITY_AVAILABLE", "message": "The required publication helper is beside the observed executable.", "capability": "atomic_publication" },
    { "id": "capability.mcp_transport_contract", "status": "PASS", "requirement": "required", "applicability": "applicable", "evidence_type": "formal_contract", "observed": "declared", "reason_code": "CAPABILITY_AVAILABLE", "message": "MCP transport is included in this build contract.", "capability": "mcp_transport" },
    { "id": "capability.session_management_contract", "status": "PASS", "requirement": "required", "applicability": "applicable", "evidence_type": "formal_contract", "observed": "declared", "reason_code": "CAPABILITY_AVAILABLE", "message": "Session management is included; no Session was created.", "capability": "session_management" },
    { "id": "sandbox.parity", "status": "UNKNOWN", "requirement": "not_applicable", "applicability": "not_applicable", "evidence_type": "not_run", "observed": null, "reason_code": "SANDBOX_PARITY_NOT_APPLICABLE", "message": "Windows host-native execution is not Unix sandbox parity.", "capability": "sandboxed_execution" },
    { "id": "goal_model.codex_cli", "status": "BLOCK", "requirement": "optional", "applicability": "applicable", "evidence_type": "static_observation", "observed": { "selected": false, "path_redacted": true }, "reason_code": "CODEX_CLI_NOT_FOUND", "message": "Codex CLI is unavailable; MCP transport remains independent.", "capability": "goal_model_execution" }
  ],
  "summary": {
    "status": "WARN",
    "required_status": "WARN",
    "advisory_status": "BLOCK",
    "runtime_status": "UNKNOWN",
    "counts": { "PASS": 3, "WARN": 1, "BLOCK": 1, "UNKNOWN": 1 },
    "checks_total": 6,
    "required_blockers": 0,
    "required_unknowns": 0,
    "exit_code": 0
  }
}
